{"configVersion":"NODE-HISTORY-LIFECYCLE-2026-07","defaultMode":"BOOTSTRAP_REVIEW","lifecyclePolicyHash":"sha256:520d42d5527739f0ddcde8e52b8cd2f1534b717d84fecbeae3d5747bc92e3ff6","modes":{"BOOTSTRAP_REVIEW":{"approvedClosureRequired":false,"matcherAuthority":"NONE","modeAvailable":true,"nodePlanAuthority":"APPROVED_BOOTSTRAP_ONLY","outputAuthority":"CURRENT_PIPELINE","registryMutationAllowed":false},"HISTORY_DRY_RUN":{"approvedClosureRequired":false,"matcherAuthority":"OBSERVATION_ONLY","modeAvailable":true,"nodePlanAuthority":"CURRENT_PIPELINE","outputAuthority":"CURRENT_PIPELINE","registryMutationAllowed":false},"HISTORY_ENFORCED":{"approvedClosureRequired":true,"matcherAuthority":"NODE_HISTORY","modeAvailable":false,"nodePlanAuthority":"NODE_HISTORY","outputAuthority":"ASSURED_NODE_HISTORY","registryMutationAllowed":true},"HISTORY_SHADOW":{"approvedClosureRequired":false,"matcherAuthority":"SHADOW_COMPARE","modeAvailable":true,"nodePlanAuthority":"SHADOW_ONLY","outputAuthority":"CURRENT_PIPELINE","registryMutationAllowed":false}},"policyVersion":"1.0.0","promotionSequence":["BOOTSTRAP_REVIEW","HISTORY_DRY_RUN","HISTORY_SHADOW","HISTORY_ENFORCED"],"rollbackMode":"HISTORY_DRY_RUN","schema":"NodeHistoryLifecyclePolicy.v1"}
